{
  "$schema": "https://json-schema.org/draft/2020-12/schema",
  "$id": "lesson",
  "title": "Lesson",
  "type": "object",
  "additionalProperties": false,
  "required": [
    "id",
    "ch",
    "openstax_section",
    "guide_line",
    "steps",
    "worked_example",
    "similar_problem",
    "sources"
  ],
  "properties": {
    "id": { "type": "string", "minLength": 1 },
    "ch": { "type": "integer", "minimum": 1, "maximum": 9 },
    "openstax_section": { "type": "string", "minLength": 1 },
    "guide_line": { "type": "string", "minLength": 1 },
    "steps": {
      "type": "array",
      "minItems": 1,
      "items": { "type": "string", "minLength": 1 }
    },
    "worked_example": {
      "type": "object",
      "additionalProperties": false,
      "required": ["q", "answer"],
      "properties": {
        "q": { "type": "string", "minLength": 1 },
        "steps": {
          "type": "array",
          "items": { "type": "string", "minLength": 1 }
        },
        "answer": { "type": "string", "minLength": 1 }
      }
    },
    "similar_problem": {
      "type": "object",
      "additionalProperties": false,
      "required": ["q", "hint", "answer"],
      "properties": {
        "q": { "type": "string", "minLength": 1 },
        "hint": { "type": "string", "minLength": 1 },
        "answer": { "type": "string", "minLength": 1 }
      }
    },
    "sources": {
      "type": "array",
      "items": { "type": "string", "minLength": 1 }
    },
    "problems": {
      "type": "array",
      "items": { "$ref": "#/$defs/problem" }
    }
  },
  "$defs": {
    "problem": {
      "type": "object",
      "additionalProperties": false,
      "required": ["id", "q", "a", "why", "hints", "check"],
      "properties": {
        "id": { "type": "string", "minLength": 1 },
        "q": { "type": "string", "minLength": 1 },
        "a": { "type": "string", "minLength": 1 },
        "why": { "type": "string", "minLength": 1 },
        "hints": {
          "type": "array",
          "items": { "type": "string", "minLength": 1 }
        },
        "check": { "$ref": "#/$defs/check" }
      }
    },
    "check": {
      "type": "object",
      "additionalProperties": false,
      "required": ["kind"],
      "properties": {
        "kind": { "enum": ["numeric", "exact"] },
        "value": { "type": "number" },
        "tolerance": { "type": "number", "minimum": 0 },
        "sigFigs": { "type": "integer", "minimum": 1 },
        "unit": { "type": ["string", "null"] },
        "text": { "type": "string" }
      }
    }
  }
}
