{
  "id": "ch6-dilution",
  "ch": 6,
  "openstax_section": "OpenStax AF2e §6.3",
  "guide_line": "Dilute a solution with M1 V1 = M2 V2.",
  "steps": [
    "Dilution adds solvent. Moles of solute stay the same.",
    "M1 V1 = M2 V2. Keep both volumes in the same unit.",
    "The final solution is weaker, so M2 is smaller than M1.",
    "The stock volume you need is smaller than the final volume.",
    "Type the number only."
  ],
  "worked_example": {
    "q": "25.0 mL of 6.00 M is diluted to 500. mL. Final molarity?",
    "steps": [
      "M2 = 6.00 × 25.0 / 500. = 0.300 M."
    ],
    "answer": "0.300 M"
  },
  "similar_problem": {
    "q": "What volume of 12.0 M stock makes 250. mL of 1.00 M?",
    "hint": "V1 = M2 V2 / M1.",
    "answer": "20.8 mL"
  },
  "sources": [
    "OpenStax AF2e §6.3"
  ],
  "problems": [
    {
      "id": "ch6-d-m1",
      "q": "25.0 mL of 6.00 M diluted to 500. mL. Final molarity?",
      "a": "0.3",
      "why": "M2 = M1 V1 / V2.",
      "hints": [
        "The answer should be smaller than 6.00."
      ],
      "check": {
        "kind": "numeric",
        "value": 0.3,
        "sigFigs": 3,
        "unit": null
      }
    },
    {
      "id": "ch6-d-v1",
      "q": "Volume, in mL, of 12.0 M stock to make 250. mL of 1.00 M?",
      "a": "20.8",
      "why": "V1 = M2 V2 / M1.",
      "hints": [
        "The stock volume is smaller than 250 mL."
      ],
      "check": {
        "kind": "numeric",
        "value": 20.8,
        "sigFigs": 3,
        "unit": null
      }
    },
    {
      "id": "ch6-d-v2",
      "q": "40.0 mL of 2.50 M is diluted to 0.500 M. Final volume in mL?",
      "a": "200",
      "why": "V2 = M1 V1 / M2.",
      "hints": [
        "The final volume is larger."
      ],
      "check": {
        "kind": "numeric",
        "value": 200,
        "sigFigs": 3,
        "unit": null
      }
    },
    {
      "id": "ch6-d-m2",
      "q": "15.0 mL of 0.800 M diluted to 60.0 mL. Final molarity?",
      "a": "0.2",
      "why": "M2 = M1 V1 / V2.",
      "hints": [
        "The answer should be smaller than 0.800."
      ],
      "check": {
        "kind": "numeric",
        "value": 0.2,
        "sigFigs": 3,
        "unit": null
      }
    },
    {
      "id": "ch6-d-v3",
      "q": "Volume, in mL, of 18.0 M stock to make 100. mL of 3.00 M?",
      "a": "16.7",
      "why": "V1 = M2 V2 / M1.",
      "hints": [
        "The stock volume is smaller than 100 mL."
      ],
      "check": {
        "kind": "numeric",
        "value": 16.7,
        "sigFigs": 3,
        "unit": null
      }
    },
    {
      "id": "ch6-d-m3",
      "q": "10.0 mL of 1.00 M diluted to 250. mL. Final molarity?",
      "a": "0.04",
      "why": "M2 = 1.00 × 10.0 / 250.",
      "hints": [
        "The answer should be smaller than 1.00."
      ],
      "check": {
        "kind": "numeric",
        "value": 0.04,
        "sigFigs": 3,
        "unit": null
      }
    },
    {
      "id": "ch6-d-v4",
      "q": "Volume, in mL, of 5.00 M stock to make 2000 mL of 0.250 M?",
      "a": "100",
      "why": "V1 = M2 V2 / M1.",
      "hints": [
        "The stock volume is smaller than 2000 mL."
      ],
      "check": {
        "kind": "numeric",
        "value": 100,
        "sigFigs": 3,
        "unit": null
      }
    },
    {
      "id": "ch6-d-v5",
      "q": "50.0 mL of 3.00 M diluted to 0.750 M. Final volume in mL?",
      "a": "200",
      "why": "V2 = M1 V1 / M2.",
      "hints": [
        "The final volume is larger."
      ],
      "check": {
        "kind": "numeric",
        "value": 200,
        "sigFigs": 3,
        "unit": null
      }
    },
    {
      "id": "ch6-d-m4",
      "q": "5.00 mL of 0.100 M diluted to 100. mL. Final molarity?",
      "a": "0.005",
      "why": "M2 = 0.100 × 5.00 / 100.",
      "hints": [
        "The answer should be smaller than 0.100."
      ],
      "check": {
        "kind": "numeric",
        "value": 0.005,
        "sigFigs": 3,
        "unit": null
      }
    },
    {
      "id": "ch6-d-v6",
      "q": "Volume, in mL, of 16.0 M stock to make 500. mL of 0.400 M?",
      "a": "12.5",
      "why": "V1 = M2 V2 / M1.",
      "hints": [
        "The stock volume is smaller than 500 mL."
      ],
      "check": {
        "kind": "numeric",
        "value": 12.5,
        "sigFigs": 3,
        "unit": null
      }
    }
  ]
}
